{
  "site": "airtable.com",
  "site_url": "https://www.airtable.com/",
  "audited_at": "2026-09-24T19:01:25Z",
  "summary": {
    "total_findings": 17,
    "critical": 0,
    "high": 4,
    "medium": 7,
    "low": 6,
    "info": 0,
    "by_category": {
      "discoverability": 12,
      "engagement": 5
    },
    "headline": "17 findings on airtable.com: the most severe is high and sits at the render gate - machines cannot read what visitors can see. Start with \"Facts appear to be locked inside images with no text equivalent\"."
  },
  "scores": {
    "overall": 66.8,
    "gates": {
      "access": 97,
      "render": 44,
      "extract": 46,
      "trust": 94,
      "engagement": 65
    }
  },
  "audit": {
    "marketplace_version": "1.0.0",
    "duration_seconds": 86.1,
    "pages_crawled": 29,
    "pages_requested": 30,
    "site_profile": {
      "site_type": "saas",
      "site_type_confidence": "medium",
      "platform": "Next.js",
      "platform_confidence": "high",
      "hosting_stack": [
        "Vercel"
      ],
      "analytics": [
        "Google Analytics 4",
        "Google Tag Manager"
      ],
      "primary_language": "en",
      "page_types_seen": [
        "about",
        "article",
        "careers",
        "case_study",
        "category",
        "docs",
        "home",
        "other",
        "pricing",
        "product",
        "section_home"
      ]
    },
    "checks_run": [
      "access",
      "answer",
      "engagement",
      "entity",
      "render",
      "schema"
    ],
    "detector_finding_counts": {
      "access": 1,
      "answer": 2,
      "engagement": 5,
      "entity": 2,
      "render": 4,
      "schema": 7
    },
    "checks_skipped": [
      {
        "check_id": "ANS-002",
        "reason": "homepage H1 is unrecognised vocabulary rather than identifiable marketing abstraction; not flagged to avoid a false positive"
      },
      {
        "check_id": "ENT-010",
        "reason": "site is not a local business; NAP consistency is not applicable"
      },
      {
        "check_id": "ENT-011",
        "reason": "the site declares no external profiles to verify"
      },
      {
        "check_id": "ENT-012",
        "reason": "only 0 declared profile(s) could be fetched; a reciprocity rate needs at least two"
      },
      {
        "check_id": "ENT-013",
        "reason": "no fetched profile carried enough text to compare against the site's own description"
      },
      {
        "check_id": "RND-002",
        "reason": "superseded by the measured render-gap comparison (RND-001)"
      },
      {
        "check_id": "RND-008",
        "reason": "no PDF documents were linked from the sampled pages"
      }
    ],
    "capabilities": {
      "javascript_rendering": true,
      "web_search": false,
      "pdf_text_extraction": false,
      "offsite_verification": true
    },
    "limitations": [],
    "notes": [
      "engagement timings are transport-level proxies measured from the audit's network location; no browser paint or field measurement was performed",
      "entity-corroboration-audit verified the external profiles this site declares as its own (sameAs and homepage profile links) for reachability and reciprocity; it never searched for the brand elsewhere, so corroboration beyond those declared profiles is still assessed by whether the site enables it, not by observing it"
    ]
  },
  "findings": [
    {
      "id": "F-001",
      "check_id": "RND-006",
      "title": "Facts appear to be locked inside images with no text equivalent",
      "severity": "high",
      "category": "discoverability",
      "gate": "render",
      "evidence": "256 images whose filename or position indicates they carry words (charts, price lists, banners, heading graphics) have no alt text, e.g. https://static.airtable.com/images/marketing-nav-platform-graphic.webp on https://www.airtable.com/.",
      "evidence_detail": {
        "examples": [
          {
            "url": "https://www.airtable.com/",
            "src": "https://static.airtable.com/images/marketing-nav-platform-graphic.webp"
          },
          {
            "url": "https://www.airtable.com/",
            "src": "https://static.airtable.com/images/marketing-nav-solution.webp"
          },
          {
            "url": "https://www.airtable.com/",
            "src": "https://static.airtable.com/images/marketing-nav-resource.webp"
          },
          {
            "url": "https://www.airtable.com/",
            "src": "https://static.airtable.com/images/homepage-variant-b/avatar-sooyoung.png"
          },
          {
            "url": "https://www.airtable.com/",
            "src": "https://static.airtable.com/images/homepage-variant-b/avatar-sooyoung.png"
          },
          {
            "url": "https://www.airtable.com/",
            "src": "https://static.airtable.com/images/homepage-variant-b/avatar-gemma.png"
          },
          {
            "url": "https://www.airtable.com/",
            "src": "https://static.airtable.com/images/homepage-variant-b/avatar-sam.png"
          },
          {
            "url": "https://www.airtable.com/",
            "src": "https://static.airtable.com/images/homepage-variant-b/avatar-sooyoung.png"
          },
          {
            "url": "https://www.airtable.com/",
            "src": "https://static.airtable.com/images/homepage-variant-b/avatar-sooyoung.png"
          },
          {
            "url": "https://www.airtable.com/",
            "src": "https://static.airtable.com/images/homepage-variant-b/avatar-sooyoung.png"
          }
        ]
      },
      "affected_urls": [
        "https://airtable.com/developers",
        "https://airtable.com/developers/agents",
        "https://airtable.com/pricing",
        "https://airtable.com/templates",
        "https://community.airtable.com/",
        "https://www.airtable.com/",
        "https://www.airtable.com/about",
        "https://www.airtable.com/ai",
        "https://www.airtable.com/articles",
        "https://www.airtable.com/articles/agency-project-management"
      ],
      "affected_count": 256,
      "sampled_count": 588,
      "mechanism": "Text drawn inside an image is invisible to every text-based reader. When a price list, an opening-hours table or a specification chart exists only as a picture, the facts on it cannot be extracted, cited, or read by assistive technology - the information is published and simultaneously unavailable.",
      "confidence": "high",
      "method": "static",
      "suggested_action": {
        "summary": "Publish the facts these images carry as real text, and give every image meaningful alt text.",
        "priority": "high",
        "how": [
          "For each image carrying data - prices, hours, specifications, comparisons - add the same content as HTML text or a table next to it. The image becomes the illustration, not the source.",
          "Write alt text that states what the image communicates, not what it depicts.",
          "Where an image is purely decorative, use alt=\"\" so readers skip it deliberately."
        ],
        "platform_specific": null,
        "effort": "medium",
        "owner": "content",
        "verify": "Re-run check RND-006; data-bearing images should have alt text and an HTML equivalent."
      }
    },
    {
      "id": "F-002",
      "check_id": "RND-010",
      "title": "Primary content appears to live inside an iframe",
      "severity": "high",
      "category": "discoverability",
      "gate": "render",
      "evidence": "5 sampled pages have under 200 words of their own body text while embedding third-party frames, e.g. https://airtable.com/marketplace/category/all-apps (22 words, embeds https://static.airtable.com/html/marketo_widget.html).",
      "evidence_detail": {
        "pages": [
          {
            "url": "https://airtable.com/marketplace/category/all-apps",
            "iframes": [
              "https://static.airtable.com/html/marketo_widget.html"
            ],
            "words": 22
          },
          {
            "url": "https://airtable.com/marketplace/category/by-airtable",
            "iframes": [
              "https://static.airtable.com/html/marketo_widget.html"
            ],
            "words": 22
          },
          {
            "url": "https://airtable.com/careers",
            "iframes": [
              "https://static.airtable.com/html/marketo_widget.html"
            ],
            "words": 22
          },
          {
            "url": "https://www.airtable.com/universe/expVVRw3oKWYCJs2t/jobs",
            "iframes": [
              "https://static.airtable.com/html/marketo_widget.html"
            ],
            "words": 22
          },
          {
            "url": "https://airtable.com/marketplace",
            "iframes": [
              "https://static.airtable.com/html/marketo_widget.html"
            ],
            "words": 22
          }
        ]
      },
      "affected_urls": [
        "https://airtable.com/marketplace/category/all-apps",
        "https://airtable.com/marketplace/category/by-airtable",
        "https://airtable.com/careers",
        "https://www.airtable.com/universe/expVVRw3oKWYCJs2t/jobs",
        "https://airtable.com/marketplace"
      ],
      "affected_count": 5,
      "sampled_count": 29,
      "mechanism": "An iframe's content belongs to the framed document, not to the page that embeds it. Indexing and retrieval attribute that content to the other URL, so the brand's page is treated as an empty container and the substance is credited elsewhere - or, when the frame is blocked from crawling, to nobody.",
      "confidence": "high",
      "method": "static",